{"schema_version":"cognitive-runtime.candidate-review-artifact/v2","review_id":"review-synthetic","candidate_id":"candidate-synthetic","candidate_revision":1,"candidate_checksum":"sha256:0000000000000000000000000000000000000000000000000000000000000000","complete_candidate":{"title":"Synthetic"},"base_authority_version":null,"exact_diff":"+ Synthetic","source_map":[{"source_ref":"src-synthetic-note"}],"created_at":"2026-08-14T01:00:00Z"}
